{
  "artifact_sha256": "3333333333333333333333333333333333333333333333333333333333333333",
  "build_commit": "0000000000000000000000000000000000000000",
  "config_bundle_sha256": "2222222222222222222222222222222222222222222222222222222222222222",
  "contract_manifest_sha256": "1111111111111111111111111111111111111111111111111111111111111111",
  "emitted_at_us": 1786156800123456,
  "event_id": "evt_triad_shadow_trade_v1",
  "event_kind": "SHADOW_TRADE",
  "payload": {
    "candidate_id": "x",
    "cost_model_version": "x",
    "evaluation_notional_quote": "0",
    "event_time_us": 1786156800123456,
    "fill_model_result": {},
    "frozen_at_us": 1786156800123456,
    "hypothesis_id": "x",
    "market_watermark": {},
    "origin_disposition": "REJECTED",
    "population": "SHADOW",
    "proposed_geometry": {},
    "recorded_time_us": 1786156800123456,
    "rejection_reason": "x",
    "rejection_stage": "x",
    "resolver_version": "x",
    "shadow_activation": "LIVE",
    "shadow_trade_id": "x",
    "simulator_version": "x",
    "terminal_outcome": {}
  },
  "producer_epoch": "42",
  "producer_instance_id": "inst_golden_01",
  "producer_service": "origin-shadow-recorder",
  "schema": "triad.shadow_trade.v1",
  "schema_version": "1.0.0"
}
